{
  "$schema": "https://raw.githubusercontent.com/matt-roz/YGOJSON/main/schema/v1/set.json",
  "id": "2c657f21-8a1f-4657-89ee-86637dfbe461",
  "name": {
    "en": "Lucky Box",
    "ko": "\ub7ed\ud0a4 \ubc15\uc2a4"
  },
  "locales": {
    "kr": {
      "language": "ko",
      "prefix": "LKB1-KR",
      "date": "2020-05-22",
      "image": "https://ms.yugipedia.com//d/d1/LKB1-PromoKR.png",
      "cardImages": {
        "unlimited": {}
      },
      "cardInfo": {
        "unlimited": {}
      },
      "formats": [
        "ocg"
      ],
      "editions": [
        "unlimited"
      ],
      "externalIDs": {
        "dbIDs": [
          78815005
        ]
      }
    }
  },
  "contents": [
    {
      "locales": [
        "kr"
      ],
      "formats": [
        "ocg"
      ],
      "editions": [
        "unlimited"
      ],
      "image": "https://ms.yugipedia.com//d/d1/LKB1-PromoKR.png",
      "cards": [
        {
          "id": "0839b7d7-e056-4a31-b6bc-68e18cf23362",
          "card": "ad383632-4a89-4bb4-a982-5030eafb560a",
          "suffix": "001",
          "rarity": "prismaticsecret"
        },
        {
          "id": "6bb8b73f-7207-455d-95af-e1e32d8100b1",
          "card": "3cf961c0-f21b-4c8a-a2c6-89063ca3d2e8",
          "suffix": "002",
          "rarity": "prismaticsecret"
        },
        {
          "id": "323063f1-1721-4cfc-a10e-7fd3de6efcc5",
          "card": "5fbc36da-e1cc-44d6-8b2b-4b8ccf1eb1ba",
          "suffix": "003",
          "rarity": "prismaticsecret"
        }
      ],
      "externalIDs": {}
    }
  ],
  "externalIDs": {
    "yugipedia": {
      "name": "Lucky Box",
      "id": 720245
    }
  }
}