{
  "$schema": "https://raw.githubusercontent.com/matt-roz/YGOJSON/main/schema/v1/set.json",
  "id": "bbdb916b-25f2-4cb1-a49c-e66d29d3fe08",
  "name": {
    "en": "Collectors Tin 2009",
    "ja": "\uff23\uff2f\uff2c\uff2c\uff25\uff23\uff34\uff2f\uff32\uff33\u3000\uff34\uff29\uff2e\u3000\uff12\uff10\uff10\uff19"
  },
  "locales": {
    "jp": {
      "language": "ja",
      "prefix": "CT09-JP",
      "date": "2009-01-17",
      "image": "https://ms.yugipedia.com//2/20/CT09-PromoJP.jpg",
      "cardImages": {
        "unlimited": {
          "07bee91c-dfbf-4527-b513-f920888337e0": "https://ms.yugipedia.com//5/5c/BlueEyesUltimateDragon-CT09-JP-GUR-RP.jpg"
        }
      },
      "cardInfo": {
        "unlimited": {
          "07bee91c-dfbf-4527-b513-f920888337e0": {
            "image": "https://ms.yugipedia.com//5/5c/BlueEyesUltimateDragon-CT09-JP-GUR-RP.jpg",
            "variants": [
              {
                "code": "RP",
                "image": "https://ms.yugipedia.com//5/5c/BlueEyesUltimateDragon-CT09-JP-GUR-RP.jpg"
              }
            ]
          }
        }
      },
      "formats": [
        "ocg"
      ],
      "editions": [
        "unlimited"
      ],
      "externalIDs": {
        "dbIDs": [
          3306005
        ]
      }
    }
  },
  "contents": [
    {
      "locales": [
        "jp"
      ],
      "formats": [
        "ocg"
      ],
      "editions": [
        "unlimited"
      ],
      "image": "https://ms.yugipedia.com//2/20/CT09-PromoJP.jpg",
      "cards": [
        {
          "id": "07bee91c-dfbf-4527-b513-f920888337e0",
          "card": "0405e64c-8e65-4dd9-bbd0-dd11d8fe6f94",
          "suffix": "001",
          "rarity": "gold",
          "replica": true
        }
      ],
      "externalIDs": {}
    }
  ],
  "externalIDs": {
    "yugipedia": {
      "name": "Collectors Tin 2009",
      "id": 47962
    }
  }
}