{
  "$schema": "https://raw.githubusercontent.com/matt-roz/YGOJSON/main/schema/v1/set.json",
  "id": "79bd6d0d-6707-4299-9a45-16a7b3633292",
  "name": {
    "en": "Yu-Gi-Oh! ARC-V Volume 6",
    "ja": "\u904a\u622f\u738b\uff21\uff32\uff23\uff0d\u2164 \u7b2c\uff16\u5dfb \u4ed8\u9332\u30ab\u30fc\u30c9"
  },
  "locales": {
    "en": {
      "language": "en",
      "prefix": "YA06-EN",
      "image": "https://ms.yugipedia.com//7/78/YA06-PromoEN.png",
      "cardImages": {
        "limited": {
          "9ec93a98-d51c-4e21-b481-f413a34f44cd": "https://ms.yugipedia.com//archive/1/13/20230512001141%21TimelordProgenitorVorpgate-YA06-EN-UR-LE.png"
        }
      },
      "cardInfo": {
        "limited": {
          "9ec93a98-d51c-4e21-b481-f413a34f44cd": {
            "image": "https://ms.yugipedia.com//archive/1/13/20230512001141%21TimelordProgenitorVorpgate-YA06-EN-UR-LE.png"
          }
        }
      },
      "formats": [
        "tcg"
      ],
      "editions": [
        "limited"
      ],
      "externalIDs": {
        "dbIDs": [
          1111115004
        ]
      }
    },
    "jp": {
      "language": "ja",
      "prefix": "YA06-JP",
      "date": "2018-10-04",
      "image": "https://ms.yugipedia.com//4/4a/YA06-PromoJP.png",
      "cardImages": {
        "unlimited": {
          "9ec93a98-d51c-4e21-b481-f413a34f44cd": "https://ms.yugipedia.com//7/72/TimelordProgenitorVorpgate-YA06-JP-UR.png"
        }
      },
      "cardInfo": {
        "unlimited": {
          "9ec93a98-d51c-4e21-b481-f413a34f44cd": {
            "image": "https://ms.yugipedia.com//7/72/TimelordProgenitorVorpgate-YA06-JP-UR.png"
          }
        }
      },
      "formats": [
        "ocg"
      ],
      "editions": [
        "unlimited"
      ],
      "externalIDs": {
        "dbIDs": [
          121220011
        ]
      }
    }
  },
  "contents": [
    {
      "locales": [
        "en"
      ],
      "formats": [
        "tcg"
      ],
      "editions": [
        "limited"
      ],
      "image": "https://ms.yugipedia.com//7/78/YA06-PromoEN.png",
      "cards": [
        {
          "id": "9ec93a98-d51c-4e21-b481-f413a34f44cd",
          "card": "0ad723fa-0879-4153-bdb1-edb767b50e71",
          "suffix": "001",
          "rarity": "ultra",
          "imageID": "d86e8331-797e-48fe-810a-b9af23d66c57"
        }
      ],
      "externalIDs": {}
    },
    {
      "locales": [
        "jp"
      ],
      "formats": [
        "ocg"
      ],
      "editions": [
        "unlimited"
      ],
      "image": "https://ms.yugipedia.com//4/4a/YA06-PromoJP.png",
      "cards": [
        {
          "id": "9ec93a98-d51c-4e21-b481-f413a34f44cd",
          "card": "0ad723fa-0879-4153-bdb1-edb767b50e71",
          "suffix": "001",
          "rarity": "ultra",
          "imageID": "d86e8331-797e-48fe-810a-b9af23d66c57"
        }
      ],
      "externalIDs": {}
    }
  ],
  "externalIDs": {
    "yugipedia": {
      "name": "Yu-Gi-Oh! ARC-V Volume 6 promotional card",
      "id": 570489
    }
  }
}