{
  "$schema": "https://raw.githubusercontent.com/matt-roz/YGOJSON/main/schema/v1/set.json",
  "id": "e14c871c-3865-4347-b939-565b9ce03eef",
  "name": {
    "en": "Hobby League 5 participation card A"
  },
  "locales": {
    "en": {
      "language": "en",
      "prefix": "HL05-EN",
      "image": "https://ms.yugipedia.com//b/b5/HL-PromoEN.jpg",
      "cardImages": {
        "unlimited": {
          "39590413-a0e7-44c3-bb82-cdf5ee19307d": "https://ms.yugipedia.com//f/fd/CrystalBeastRubyCarbuncle-HL05-EN-UPR-UE.png"
        }
      },
      "cardInfo": {
        "unlimited": {
          "39590413-a0e7-44c3-bb82-cdf5ee19307d": {
            "image": "https://ms.yugipedia.com//f/fd/CrystalBeastRubyCarbuncle-HL05-EN-UPR-UE.png"
          }
        }
      },
      "formats": [
        "tcg"
      ],
      "editions": [
        "unlimited"
      ],
      "externalIDs": {
        "dbIDs": [
          1121206006
        ]
      }
    }
  },
  "contents": [
    {
      "locales": [
        "en"
      ],
      "formats": [
        "tcg"
      ],
      "distrobution": "preconstructed",
      "editions": [
        "unlimited"
      ],
      "image": "https://ms.yugipedia.com//b/b5/HL-PromoEN.jpg",
      "cards": [
        {
          "id": "39590413-a0e7-44c3-bb82-cdf5ee19307d",
          "card": "07e7f947-f333-4cf9-8199-420d250e0cea",
          "suffix": "001",
          "rarity": "ultraparallel",
          "imageID": "16d322a6-3d50-448c-8e69-f9a93181b7a4"
        }
      ],
      "externalIDs": {}
    }
  ],
  "externalIDs": {
    "yugipedia": {
      "name": "Hobby League 5 participation card A",
      "id": 305591
    }
  }
}