{
  "$schema": "https://raw.githubusercontent.com/matt-roz/YGOJSON/main/schema/v1/set.json",
  "id": "06b8a440-f10b-4a56-a489-fa26d6b4a1cc",
  "date": "2023-03-17",
  "name": {
    "en": "Structure Deck EX: Secret of Magicians"
  },
  "contents": [
    {
      "formats": [
        "duellinks"
      ],
      "image": "https://ms.yugipedia.com//3/38/SecretofMagicians.png",
      "cards": [
        {
          "id": "d97c9718-5935-4d89-95c5-8e2d4bcea674",
          "card": "feb59a85-c0a1-445c-a01e-2022743d281b",
          "imageID": "58b31724-8247-419d-8204-a2afd60f9206"
        },
        {
          "id": "4802eadb-5796-4c68-a2b5-5f6ee387933b",
          "card": "65f522c4-720f-42e7-88f1-9da62e567387",
          "imageID": "1e05a998-3548-4e2b-a7b7-ba242fb2ece0"
        },
        {
          "id": "6cead9f6-0594-45ed-ad0f-363202fbe867",
          "card": "9fd4f243-d31f-44fb-be79-3e9144912219",
          "imageID": "ddeeabf2-c807-4015-a726-3ddc5fc67fed"
        },
        {
          "id": "83ec4910-1ca6-4911-b374-0bc350c6635e",
          "card": "3ae0131e-6896-4176-894a-78659b2f4751",
          "imageID": "1e2123d3-fa11-4d24-a706-08430e175d51"
        },
        {
          "id": "b748452a-9b3e-425d-8d2d-3c2c8ad45f84",
          "card": "4f9a54ad-0475-4419-b4e8-de0ec7efd80f",
          "imageID": "6d8e9ccf-0a04-476e-84c2-8df15f10d3ca"
        },
        {
          "id": "8c40b8da-41a5-4cf8-99bf-d9384e6b7966",
          "card": "d497f3b4-d921-4bfc-bfae-fa9026a083c1"
        },
        {
          "id": "69830cb8-32de-49e9-bfb4-97384d2f0126",
          "card": "f394d2a1-e71e-4d59-acb5-44add2e12249",
          "imageID": "7b03e49b-c281-406d-8f58-70769a4a5581"
        },
        {
          "id": "947c566c-8516-4001-9125-e0f34e305781",
          "card": "df3d47ab-9c50-4419-b23a-5313707921b9",
          "imageID": "793347ef-fb01-407d-9134-500cb50687a8"
        },
        {
          "id": "9785170f-adfc-40e1-9633-8e9036277a38",
          "card": "a616e8ff-73a5-43ed-88ee-7213347c08a5",
          "imageID": "7dc676ea-53ed-4d54-a626-0a4ba1f15b9d"
        },
        {
          "id": "6ff5b859-5b7e-46ae-94d9-e9fb3b96691b",
          "card": "9d8b0680-6dfa-4fe0-a077-4e69c55849ef",
          "imageID": "318cdc81-f436-44a9-8926-0fa5f299a235"
        },
        {
          "id": "3fbb48be-5e6b-4378-b0ad-a4f178f82240",
          "card": "a77b6c1d-b3f6-47ce-af55-438f487eb7a2",
          "imageID": "86c0a47e-e4cf-4071-81a8-403dd4e9431c"
        },
        {
          "id": "70676f98-57cb-4830-8f14-fd53acf6c4a5",
          "card": "c42c5bee-43c3-4d29-bf0a-64d5ec5c4eed",
          "imageID": "55c3d7d7-5752-439d-9387-fb7c86cd5b61"
        },
        {
          "id": "e24882ef-d0b1-4757-9869-8d40b6203454",
          "card": "989b8cbd-0489-485e-ad06-2ee7ace14aa4",
          "imageID": "51a82799-5486-47b4-80a9-4988804cbddc"
        },
        {
          "id": "fbb6817f-fbe7-481f-bfbb-59cb732c3bca",
          "card": "cbf68183-f47a-41d1-af2e-9d390c9a5841",
          "imageID": "d03bdf29-e286-4eb0-a9b7-17db6aa80790"
        },
        {
          "id": "b46d1865-f5e0-45a1-ac74-70b5eb3738e2",
          "card": "ee294350-23e4-44a7-8113-da31d246dd34",
          "imageID": "4e50c6f5-11b8-4067-b7da-1ae13155dc62"
        },
        {
          "id": "f69cbfdb-2e4d-4a4a-9ffb-5f4af8b28dae",
          "card": "0f67825e-26a6-461f-8a51-afd10b5edc1f",
          "imageID": "6cf18ef6-8d0f-44fb-9a98-c99a3b6d00bc"
        },
        {
          "id": "27932ea6-992d-411f-b2d7-8130224eb90d",
          "card": "3625b745-fa82-4faa-8469-0c479162bc35",
          "imageID": "4df1ac0a-fdcc-41d7-b214-13fe969d8156"
        },
        {
          "id": "61ca91b2-a95a-4469-ad09-23136280128c",
          "card": "e1dddb38-c69d-474d-b885-3dfbc1c47a14",
          "imageID": "b7c720e8-b85d-40a7-8b97-8958eeb77321"
        }
      ],
      "externalIDs": {}
    }
  ],
  "externalIDs": {
    "yugipedia": {
      "name": "Structure Deck EX: Secret of Magicians",
      "id": 991664
    }
  }
}