{
  "$schema": "https://raw.githubusercontent.com/matt-roz/YGOJSON/main/schema/v1/set.json",
  "id": "16f8bfee-60d6-4ac9-b990-fba1401f3db2",
  "name": {
    "en": "Yu-Gi-Oh! World Championship 2019 Japanese National Qualifiers prize cards"
  },
  "locales": {
    "en": {
      "language": "en",
      "prefix": "2019-EN",
      "date": "2019-02-01",
      "image": "https://ms.yugipedia.com//d/d3/2019-LogoEN.png",
      "cardImages": {
        "unlimited": {
          "6193ea8f-45ef-49c3-b049-132b97379124": "https://ms.yugipedia.com//2/23/AmatsuOkamioftheDivinePeaks-2019-EN-UR-UE-RP.png",
          "7ed259f6-aa6c-49b6-a8a6-bb804b481531": "https://ms.yugipedia.com//a/a0/NoritoshiinDarkestRainment-2019-EN-UR-UE-RP.png"
        }
      },
      "cardInfo": {
        "unlimited": {
          "6193ea8f-45ef-49c3-b049-132b97379124": {
            "image": "https://ms.yugipedia.com//2/23/AmatsuOkamioftheDivinePeaks-2019-EN-UR-UE-RP.png",
            "variants": [
              {
                "code": "RP",
                "image": "https://ms.yugipedia.com//2/23/AmatsuOkamioftheDivinePeaks-2019-EN-UR-UE-RP.png"
              }
            ]
          },
          "7ed259f6-aa6c-49b6-a8a6-bb804b481531": {
            "image": "https://ms.yugipedia.com//a/a0/NoritoshiinDarkestRainment-2019-EN-UR-UE-RP.png",
            "variants": [
              {
                "code": "RP",
                "image": "https://ms.yugipedia.com//a/a0/NoritoshiinDarkestRainment-2019-EN-UR-UE-RP.png"
              }
            ]
          }
        }
      },
      "formats": [
        "tcg"
      ],
      "editions": [
        "unlimited"
      ],
      "externalIDs": {
        "dbIDs": [
          1121218002
        ]
      }
    }
  },
  "contents": [
    {
      "locales": [
        "en"
      ],
      "formats": [
        "tcg"
      ],
      "editions": [
        "unlimited"
      ],
      "image": "https://ms.yugipedia.com//d/d3/2019-LogoEN.png",
      "cards": [
        {
          "id": "6193ea8f-45ef-49c3-b049-132b97379124",
          "card": "a35e7c32-0439-41c6-aa6e-51641aae345c",
          "suffix": "003",
          "rarity": "ultra",
          "imageID": "fc64c313-d4bd-4b19-b6a2-16aa8541b771",
          "replica": true
        },
        {
          "id": "7ed259f6-aa6c-49b6-a8a6-bb804b481531",
          "card": "215161b0-d0ca-4002-86b4-19045c007487",
          "suffix": "004",
          "rarity": "ultra",
          "imageID": "393878f3-9c28-4396-8f7a-645bc2653b94",
          "replica": true
        }
      ],
      "externalIDs": {}
    }
  ],
  "externalIDs": {
    "yugipedia": {
      "name": "Yu-Gi-Oh! World Championship 2019 Japanese National Qualifiers prize cards",
      "id": 608009
    }
  }
}