{
  "$schema": "https://raw.githubusercontent.com/matt-roz/YGOJSON/main/schema/v1/set.json",
  "id": "bcbed07b-701f-4e38-8afa-47d45e423e10",
  "name": {
    "en": "Cup Noodle collaboration card",
    "ja": "\u30ab\u30c3\u30d7\u30cc\u30fc\u30c9\u30eb \u30b3\u30e9\u30dc\u30ab\u30fc\u30c9"
  },
  "locales": {
    "jp": {
      "language": "ja",
      "prefix": "NSC1-JP",
      "date": "2026-03-18",
      "image": "https://ms.yugipedia.com//8/83/NSC1-PromoJP.png",
      "cardImages": {
        "unlimited": {}
      },
      "cardInfo": {
        "unlimited": {}
      },
      "formats": [
        "ocg"
      ],
      "editions": [
        "unlimited"
      ],
      "externalIDs": {
        "dbIDs": [
          1000009577000
        ]
      }
    }
  },
  "contents": [
    {
      "locales": [
        "jp"
      ],
      "formats": [
        "ocg"
      ],
      "editions": [
        "unlimited"
      ],
      "image": "https://ms.yugipedia.com//8/83/NSC1-PromoJP.png",
      "cards": [
        {
          "id": "4814f761-9e53-4f23-a28b-abd87b198c95",
          "card": "680e0ecd-8147-434d-836d-5c998bbc60d7",
          "suffix": "001",
          "rarity": "commonparallel",
          "imageID": "33d44a6a-bf13-4423-9cba-32dfe2a37e83",
          "printStatus": "reprint"
        }
      ],
      "externalIDs": {}
    }
  ],
  "externalIDs": {
    "yugipedia": {
      "name": "Cup Noodle collaboration card",
      "id": 1180206
    }
  }
}