{
  "$schema": "https://raw.githubusercontent.com/matt-roz/YGOJSON/main/schema/v1/set.json",
  "id": "ff0f3219-e8dd-45f1-bf65-77f4e84488ae",
  "date": "2022-01-19",
  "name": {
    "en": "Pearlescent Cyber Dragons"
  },
  "contents": [
    {
      "formats": [
        "masterduel"
      ],
      "image": "https://ms.yugipedia.com//1/12/Pearlescent_Cyber_Dragons-Pack-Master_Duel.png",
      "cards": [
        {
          "id": "be42c2f8-668d-4452-b59a-9b11ad86cf8d",
          "card": "c961c3cb-ad2c-4327-87a7-3fc0f6955ede"
        },
        {
          "id": "1c24f879-3238-47d3-9d7c-f6f4f6703223",
          "card": "c1bd1374-94f0-49e8-b14f-8f618547b9fd"
        },
        {
          "id": "dff05470-fd4c-4200-804c-efe18fb371fc",
          "card": "1d098d22-d405-4881-90b3-64fd7ba04404"
        },
        {
          "id": "5b518bc4-037d-4a40-85de-3eb6e343cfd6",
          "card": "88da3ebe-30fd-49fd-aec8-7d080938ab5e"
        },
        {
          "id": "ab70f46e-72f8-4c30-b998-3472fff24801",
          "card": "a4bf296f-09be-4e31-9d5f-f78476c86db6"
        },
        {
          "id": "fc553cb0-a558-4096-be8f-97f6f9f44e22",
          "card": "53efdd13-5828-4492-96af-65485f22a408",
          "imageID": "592481f1-3896-4623-ad71-c24225350350"
        },
        {
          "id": "9cf21e57-4beb-404a-87eb-ad5f596f9938",
          "card": "90ea4c0a-426b-4568-9b44-54b1c206ebe6",
          "imageID": "fc25c05e-551b-42d4-9dd0-bc6058d4bbbc"
        },
        {
          "id": "f65933f8-ac45-4222-a909-273bb28aa370",
          "card": "0a5c3f72-054c-4b0a-828d-c327a33b5683"
        },
        {
          "id": "0d83e912-6b61-4009-830c-0d269c01a244",
          "card": "4d10fc5f-70c0-47f7-8731-a7b958b2de44"
        },
        {
          "id": "0503b1e5-aabd-4387-91af-9d4288d11c77",
          "card": "d1aef1f7-23ad-4228-a912-28c860873c19",
          "imageID": "0f29f24c-35e6-43b1-a441-b7907669152e"
        },
        {
          "id": "dafed9ed-df75-4a8d-a932-2d881ea2bf2c",
          "card": "882e6a13-be66-4abd-8bfc-6d47ad58960b",
          "imageID": "70619284-13b6-4504-8e4a-1dcdc696595d"
        },
        {
          "id": "49910acd-90ad-4644-a549-07df5e25a086",
          "card": "aa97e07a-b6e5-466e-a4ce-5f983be340eb",
          "imageID": "770711dd-2eb9-4bf9-b072-de656c10de61"
        },
        {
          "id": "8c5b617a-31b3-4dc3-994d-23284a66c3ac",
          "card": "e3e0e1bd-b78f-46cd-9185-7951d3b8b76c",
          "imageID": "22dfaf04-3d13-485a-9a44-d3914ff1ebf5"
        },
        {
          "id": "ec36db55-3b6a-4026-8993-d07d8bbf451a",
          "card": "900e311d-3b2f-4d75-9156-2fad573229b5",
          "imageID": "69060bf9-e0e9-4b39-8725-ac7cb4ce4697"
        },
        {
          "id": "cf339448-bdd7-414f-ac5f-20ad7e6de131",
          "card": "c2639f29-2d22-4c4c-99a5-e4b5128ed30a",
          "imageID": "3112758d-28d3-430b-9b80-1c5b01dbd7f2"
        },
        {
          "id": "04c0ca75-fbce-48a0-b2f2-b008e0d72322",
          "card": "42f3ae5a-03dd-4559-8e7f-0826df3f9c12",
          "imageID": "a504beb6-18ef-4b38-9819-af0a439d3c18"
        },
        {
          "id": "9269a0dc-ea6a-43cf-b21d-cb4025f60d9d",
          "card": "46d73fe6-0450-4b11-8744-3ca1be9fbc3a",
          "imageID": "74a80bb9-3217-4665-8169-ebef46073f1e"
        },
        {
          "id": "8da86f8b-cdf5-4073-a54b-0ca68e222dc9",
          "card": "ceeaa077-2dc6-49a3-bacf-147e57cafd19",
          "imageID": "e2ae9d60-926c-49b8-8d95-45f7155fe54d"
        },
        {
          "id": "a65651e0-e672-4bb5-a45c-fdf3b939642c",
          "card": "fd7fdae3-af46-40ae-b5f8-c59229c51535",
          "imageID": "5f6a20b2-03ed-40c8-8d48-e169930bb9e4"
        },
        {
          "id": "a756f7e0-0e9b-4dbc-a11d-c42f72e64791",
          "card": "bdae59bd-756a-4c6b-b951-ef77d4f6acf0",
          "imageID": "a18ee0d6-7ac6-4e71-a479-02fa54b7be3f"
        },
        {
          "id": "4b00e3c5-4762-4f93-9786-ad44f22f065b",
          "card": "96f38380-d3aa-4a14-be66-19ca254fc502",
          "imageID": "247e2dc2-cbca-421e-b905-9761d2e5c38a"
        },
        {
          "id": "96183012-779a-4d71-994a-3fc7981f4fc6",
          "card": "ca5bc8b5-c4f1-413e-ab45-9ee20e082f03",
          "imageID": "71022254-3c73-45cb-90b8-788fd1685ed6"
        },
        {
          "id": "cbab30f6-fd1c-4878-8474-1e2c7f07ef00",
          "card": "77bc0807-d7fc-461d-98dc-ea23a2acc6fa"
        },
        {
          "id": "0a666f2e-245b-46b3-98cd-d606a2b10d73",
          "card": "e50d20f9-6c06-4e99-aa43-377d175a33a8",
          "imageID": "caf8d06d-fbe2-4d76-ba57-c54c5b24fe0b"
        },
        {
          "id": "7c955a92-d809-4da1-aad3-d396074effbf",
          "card": "7075e59c-08d4-4d1c-98ae-2a6cb4c62e74",
          "imageID": "ed392a2f-e8d7-4b76-8a5a-4d74a95e4eb3"
        },
        {
          "id": "c2e0ad53-3a8a-41ec-ba2a-c62099d7945d",
          "card": "f8040a36-6bc6-4b1b-8364-645553002c62",
          "imageID": "6aaf85fd-b874-4b3e-812c-5fd1d2c7ec8e"
        },
        {
          "id": "0d862689-3bbf-4a3d-a8eb-2f700eab95c1",
          "card": "644a8189-f8f2-4b3f-9200-5df97a768166",
          "imageID": "66724f91-3497-4b72-b2fc-bca99969f27a"
        },
        {
          "id": "574c1169-c23a-4725-bded-92ba8cd6eb27",
          "card": "75e628aa-f1ed-4958-a24e-3a5b1fc7d90e",
          "imageID": "f5788fb1-5dbe-4a61-a6f3-5853a43f0b67"
        },
        {
          "id": "dc897254-6dd1-4657-9375-5c371f5f8ca2",
          "card": "d5fbcffa-dbc9-4315-a7b3-ca64cf2de480",
          "imageID": "3bbf51d6-c7d8-4e9f-92f0-4217389d74ef"
        },
        {
          "id": "aaeb9009-41dc-4966-8c26-13b596bd0586",
          "card": "2287a840-e23e-4f91-8494-ed8b72d1f6e8",
          "imageID": "52e18c36-68c6-4eb3-a0b9-72fbb3e9d661"
        },
        {
          "id": "410d757b-2c71-4664-8c07-b3444c556762",
          "card": "c07248ca-252a-4d84-ae38-966e0ebcfcb9",
          "imageID": "972c171c-6805-47bb-9bbd-afeda93d525d"
        },
        {
          "id": "6ed214d2-0d0a-495c-9520-38ab206174fe",
          "card": "c642c2f5-faaf-47f9-a636-96215340ce94",
          "imageID": "f1a0a5ec-e7e4-4b97-b596-0cde4b98a0cc"
        },
        {
          "id": "f449b543-915a-45bd-8d32-1dd9d7ab507a",
          "card": "40464591-2b13-4977-89e1-c937b54c4929",
          "imageID": "dc0b766f-2575-499d-a130-525396d669e0"
        },
        {
          "id": "48e0e0dd-1a86-4d83-a9b7-4ba5cc1a5937",
          "card": "c0b414a6-07dc-458d-b6f6-0fd769eeea7e",
          "imageID": "717605ff-c53b-4a5e-8bc2-9aa496d281da"
        },
        {
          "id": "673f6db0-e370-4b73-86b1-b9f3bf5638b2",
          "card": "1a2bad1d-d2f2-4dc1-84d5-426b3d5ee8ac",
          "imageID": "b12d36e7-a53c-418d-8a3f-c3b3d4fb7978"
        },
        {
          "id": "edb9b192-415d-4ea6-8eba-c0cb9a672d7a",
          "card": "6a999de6-cc38-4c4b-8440-45d64938f341",
          "imageID": "26e1f7b7-bab9-440d-b2d5-084df22d186a"
        },
        {
          "id": "b338e736-694e-4510-8685-a5aad5e9f3eb",
          "card": "3fbfc8ed-9661-4b03-b623-515450f99fac",
          "imageID": "7b180aeb-4e81-432d-81a0-b43c67b1396e"
        },
        {
          "id": "9f880491-4329-4f48-8359-5a604074647b",
          "card": "1ccf7fbc-f619-408a-8959-c32c6d159456",
          "imageID": "f9ff3419-21ac-413b-8078-a5706266c734"
        },
        {
          "id": "26c71999-de47-4fa4-9ae3-37ede24bbd62",
          "card": "a8dd6355-ed37-4f1c-95f5-f4d0f884f186",
          "imageID": "2e51b213-adcc-41f1-aa24-3878e0618625"
        },
        {
          "id": "9d464ec0-f67d-43b7-b212-38236e824c68",
          "card": "35245cf0-eb2f-4c19-b7cb-7e2e9a233089",
          "imageID": "a05a376a-4538-4a1f-97d6-c13ea7cec337"
        },
        {
          "id": "b515f9b8-ecab-4df9-8523-e6ce5c27eb6e",
          "card": "a9c228e0-61af-48a4-bee7-ea6a5944199e",
          "imageID": "d22b8081-1da1-4f18-9714-f96d41d73462"
        },
        {
          "id": "97b5b3bf-d74b-447b-b47b-6841c21c3fa2",
          "card": "3a23743f-f9dc-4ec2-b514-64759ff1af51",
          "imageID": "30b4ef54-babf-47bc-9e28-8e8b6a8d3a36"
        },
        {
          "id": "97fddb77-76dc-4335-a058-8fdc51977f8f",
          "card": "a21bd66b-60dc-4149-98ce-40298aa14285",
          "imageID": "b73ce3e4-ff9f-4cb2-9b54-7abcd0b9de31"
        },
        {
          "id": "8646d0f4-d38f-484b-96f6-6e5232b771fa",
          "card": "9d4c88c5-8367-43db-b0b5-cf553ebe75e8",
          "imageID": "4db7161e-f700-431e-8402-eba9d8f2975f"
        },
        {
          "id": "7281083e-7996-41c6-ab62-5b62a4d00c14",
          "card": "3cca6d2c-8e01-42c1-900a-54006542791a",
          "imageID": "46eccc01-ff28-41dd-93c6-9e3045186658"
        },
        {
          "id": "958e0a01-f848-4f10-bd64-47e19361f79a",
          "card": "a7d5c95a-dc4a-4eb5-ab50-15db2d472502",
          "imageID": "9334cc28-4cdc-4646-91fa-27ee7729a0a7"
        }
      ],
      "externalIDs": {}
    }
  ],
  "externalIDs": {
    "yugipedia": {
      "name": "Pearlescent Cyber Dragons",
      "id": 904779
    }
  }
}