{
  "$schema": "https://raw.githubusercontent.com/matt-roz/YGOJSON/main/schema/v1/set.json",
  "id": "c9af6c90-13a7-45ed-8453-0b5e671f38f9",
  "name": {
    "en": "Yu-Gi-Oh! Championship Series 2026 prize cards"
  },
  "locales": {
    "en": {
      "language": "en",
      "prefix": "26YC-EN",
      "image": "https://ms.yugipedia.com//e/e7/YCSW-PromoEN.png",
      "cardImages": {
        "limited": {}
      },
      "cardInfo": {
        "limited": {}
      },
      "formats": [
        "tcg"
      ],
      "editions": [
        "limited"
      ],
      "externalIDs": {}
    }
  },
  "contents": [
    {
      "locales": [
        "en"
      ],
      "formats": [
        "tcg"
      ],
      "editions": [
        "limited"
      ],
      "image": "https://ms.yugipedia.com//e/e7/YCSW-PromoEN.png",
      "cards": [
        {
          "id": "1be27fcc-ff09-402f-8086-a46cc4cc8c14",
          "card": "0626cd7e-9544-4a18-8625-85b0ac76bb54",
          "suffix": "001",
          "rarity": "super",
          "imageID": "de3328cf-a5fb-417a-8648-c518c10f8327",
          "printStatus": "reprint",
          "printNote": "New artwork"
        },
        {
          "id": "21e7c7da-673a-4b77-8898-e317b19f9700",
          "card": "0626cd7e-9544-4a18-8625-85b0ac76bb54",
          "suffix": "001",
          "rarity": "ultra",
          "imageID": "de3328cf-a5fb-417a-8648-c518c10f8327",
          "printStatus": "reprint",
          "printNote": "New artwork"
        },
        {
          "id": "79da113f-5435-4dfe-bbf8-aeae2ef57558",
          "card": "07240dec-046f-4b64-a5ab-9fe3508dda64",
          "suffix": "002",
          "rarity": "ultra",
          "imageID": "bfe0f624-b178-4a80-be19-a0bf2577c989",
          "printStatus": "reprint",
          "printNote": "New artwork"
        },
        {
          "id": "08db2835-ffa4-4c43-8bf4-47d00817d923",
          "card": "f9416d3f-4611-45ff-b993-52b75d6861a7",
          "suffix": "003",
          "rarity": "super",
          "imageID": "06ae8f45-07a7-4f51-86a2-66cfc7c818c3",
          "printStatus": "reprint"
        },
        {
          "id": "a3823775-32f5-4525-a9f9-c2ee3d88d25d",
          "card": "5f925c26-760d-46c2-ba6e-f796f9047471",
          "suffix": "P01",
          "rarity": "rare",
          "printStatus": "reprint"
        },
        {
          "id": "902f6278-8880-4bbb-ac9c-8e3672d301a8",
          "card": "61d244e6-8ced-4c36-a928-de1d3a0c5a63",
          "suffix": "P02",
          "rarity": "rare",
          "printStatus": "reprint"
        },
        {
          "id": "5ad910e1-9d8a-4917-badc-0c65c998d12b",
          "card": "c9b260a5-9425-4760-aa12-c08075b304be",
          "suffix": "P03",
          "rarity": "rare",
          "printStatus": "reprint"
        },
        {
          "id": "0b020dee-f5de-4818-891e-43ae782139d1",
          "card": "d15ea879-903e-481a-9ad1-774823a8518b",
          "suffix": "P04",
          "rarity": "rare",
          "imageID": "f7eb3c46-62df-45ec-9be3-877f11a4a522",
          "printStatus": "reprint"
        },
        {
          "id": "d97bfe71-dfa2-4ae2-959e-633655370c30",
          "card": "a4cbeef5-b0cb-42f3-9f43-baa542f76e6c",
          "suffix": "P05",
          "rarity": "rare",
          "imageID": "92f77a4f-4f2a-4211-b372-d9c171a41a51",
          "printStatus": "reprint"
        },
        {
          "id": "62476c2f-b8eb-4079-ad92-06d79278e1a1",
          "card": "846ce79f-da67-4824-b2d4-a5220aec067b",
          "suffix": "P06",
          "rarity": "rare",
          "imageID": "cc91b07e-909a-4c8f-bc5f-8d7c1ba39082",
          "printStatus": "reprint"
        },
        {
          "id": "d8225e54-9d25-4507-bdfd-3287f5ec1314",
          "card": "29d0013b-2b95-4e47-9921-403187c94dd7",
          "suffix": "P07",
          "rarity": "rare",
          "imageID": "43f86629-4d5f-42f8-9186-98a74cc181c5",
          "printStatus": "reprint"
        },
        {
          "id": "8e6b5a7a-6b89-46e2-9b6d-4068e837b50b",
          "card": "7c6b3a37-b4a9-4cc2-92c0-869f1f596868",
          "suffix": "P08",
          "rarity": "rare",
          "imageID": "23c566c7-76d7-467c-86ac-58059d84dc4a",
          "printStatus": "reprint"
        },
        {
          "id": "350e0722-40ec-468c-b127-a379b92bb405",
          "card": "485f5c46-fbda-480c-a850-742fca2d1ce5",
          "suffix": "P09",
          "rarity": "rare",
          "imageID": "809da9ee-99a1-4c84-93a6-3b7f2d2d1ddd",
          "printStatus": "reprint"
        },
        {
          "id": "e2534a1e-bd50-410e-bd27-726c2089616b",
          "card": "7814f26d-a7e7-4b1b-9932-2bb738a30c49",
          "suffix": "P10",
          "rarity": "rare",
          "imageID": "6895073c-5882-4813-b997-1b8fd74f3f82",
          "printStatus": "reprint"
        }
      ],
      "externalIDs": {}
    }
  ],
  "externalIDs": {
    "yugipedia": {
      "name": "Yu-Gi-Oh! Championship Series 2026 prize cards",
      "id": 1210928
    }
  }
}