{
  "$schema": "https://raw.githubusercontent.com/matt-roz/YGOJSON/main/schema/v1/set.json",
  "id": "737f5ff0-6f07-4f88-9257-9a237648e63a",
  "name": {
    "en": "The Lost Art Promotion 2023 D"
  },
  "locales": {
    "en": {
      "language": "en",
      "prefix": "LART-EN",
      "image": "https://ms.yugipedia.com//9/95/LART-PromoEN-SenjuoftheThousandHands.png",
      "cardImages": {
        "limited": {}
      },
      "cardInfo": {
        "limited": {}
      },
      "formats": [
        "tcg"
      ],
      "editions": [
        "limited"
      ],
      "externalIDs": {
        "dbIDs": [
          2000001227000
        ]
      }
    },
    "fr": {
      "language": "fr",
      "date": "2023-04-01",
      "cardImages": {},
      "cardInfo": {},
      "formats": [
        "tcg"
      ],
      "externalIDs": {}
    },
    "de": {
      "language": "de",
      "date": "2023-04-01",
      "cardImages": {},
      "cardInfo": {},
      "formats": [
        "tcg"
      ],
      "externalIDs": {}
    },
    "it": {
      "language": "it",
      "date": "2023-04-01",
      "cardImages": {},
      "cardInfo": {},
      "formats": [
        "tcg"
      ],
      "externalIDs": {}
    },
    "pt": {
      "language": "pt",
      "cardImages": {},
      "cardInfo": {},
      "formats": [
        "tcg"
      ],
      "externalIDs": {}
    },
    "sp": {
      "language": "es",
      "date": "2023-04-01",
      "cardImages": {},
      "cardInfo": {},
      "formats": [
        "tcg"
      ],
      "externalIDs": {}
    }
  },
  "contents": [
    {
      "locales": [
        "en"
      ],
      "formats": [
        "tcg"
      ],
      "editions": [
        "limited"
      ],
      "image": "https://ms.yugipedia.com//9/95/LART-PromoEN-SenjuoftheThousandHands.png",
      "cards": [
        {
          "id": "ed7ceacb-ca0f-415f-bd41-ecd56322441b",
          "card": "30695653-138a-4684-a38b-c0cc31c0078d",
          "suffix": "057",
          "rarity": "ultra"
        }
      ],
      "externalIDs": {}
    },
    {
      "locales": [
        "fr"
      ],
      "formats": [
        "tcg"
      ],
      "cards": [],
      "externalIDs": {}
    },
    {
      "locales": [
        "de"
      ],
      "formats": [
        "tcg"
      ],
      "cards": [],
      "externalIDs": {}
    },
    {
      "locales": [
        "it"
      ],
      "formats": [
        "tcg"
      ],
      "cards": [],
      "externalIDs": {}
    },
    {
      "locales": [
        "pt"
      ],
      "formats": [
        "tcg"
      ],
      "cards": [],
      "externalIDs": {}
    },
    {
      "locales": [
        "sp"
      ],
      "formats": [
        "tcg"
      ],
      "cards": [],
      "externalIDs": {}
    }
  ],
  "externalIDs": {
    "yugipedia": {
      "name": "The Lost Art Promotion 2023 D",
      "id": 928747
    }
  }
}