{
  "$schema": "https://raw.githubusercontent.com/matt-roz/YGOJSON/main/schema/v1/set.json",
  "id": "b5f97013-c746-49ea-8824-9286bfc2bdb0",
  "name": {
    "en": "Rage of the Abyss Premiere!",
    "fr": "La Rage des Abysses Premiere!",
    "de": "Rage of the Abyss Premiere!",
    "it": "Rabbia dell'Abisso Premiere!",
    "pt": "F\u00faria do Abismo Premiere!",
    "es": "Ira del Abismo Premiere!"
  },
  "locales": {
    "en": {
      "language": "en",
      "prefix": "ROTA-ENSP",
      "image": "https://ms.yugipedia.com//9/9a/ROTA-LogoEN.png",
      "cardImages": {
        "limited": {}
      },
      "cardInfo": {
        "limited": {}
      },
      "formats": [
        "tcg"
      ],
      "editions": [
        "limited"
      ],
      "externalIDs": {
        "dbIDs": [
          2000001400000
        ]
      }
    },
    "fr": {
      "language": "fr",
      "date": "2024-10-04",
      "cardImages": {},
      "cardInfo": {},
      "formats": [
        "tcg"
      ],
      "externalIDs": {}
    },
    "de": {
      "language": "de",
      "date": "2024-10-04",
      "cardImages": {},
      "cardInfo": {},
      "formats": [
        "tcg"
      ],
      "externalIDs": {}
    },
    "it": {
      "language": "it",
      "date": "2024-10-04",
      "cardImages": {},
      "cardInfo": {},
      "formats": [
        "tcg"
      ],
      "externalIDs": {}
    },
    "pt": {
      "language": "pt",
      "date": "2024-10-04",
      "cardImages": {},
      "cardInfo": {},
      "formats": [
        "tcg"
      ],
      "externalIDs": {}
    },
    "sp": {
      "language": "es",
      "date": "2024-10-04",
      "cardImages": {},
      "cardInfo": {},
      "formats": [
        "tcg"
      ],
      "externalIDs": {}
    }
  },
  "contents": [
    {
      "locales": [
        "en"
      ],
      "formats": [
        "tcg"
      ],
      "editions": [
        "limited"
      ],
      "image": "https://ms.yugipedia.com//9/9a/ROTA-LogoEN.png",
      "cards": [
        {
          "id": "2cadb987-ef10-4423-a89f-32c791c04f0b",
          "card": "d4614961-d66d-4d97-b22e-86f062b4c14c",
          "suffix": "1",
          "rarity": "ultra"
        }
      ],
      "externalIDs": {}
    },
    {
      "locales": [
        "fr"
      ],
      "formats": [
        "tcg"
      ],
      "cards": [],
      "externalIDs": {}
    },
    {
      "locales": [
        "de"
      ],
      "formats": [
        "tcg"
      ],
      "cards": [],
      "externalIDs": {}
    },
    {
      "locales": [
        "it"
      ],
      "formats": [
        "tcg"
      ],
      "cards": [],
      "externalIDs": {}
    },
    {
      "locales": [
        "pt"
      ],
      "formats": [
        "tcg"
      ],
      "cards": [],
      "externalIDs": {}
    },
    {
      "locales": [
        "sp"
      ],
      "formats": [
        "tcg"
      ],
      "cards": [],
      "externalIDs": {}
    }
  ],
  "externalIDs": {
    "yugipedia": {
      "name": "Rage of the Abyss Premiere! promotional card",
      "id": 1076421
    }
  }
}