{
  "$schema": "https://raw.githubusercontent.com/matt-roz/YGOJSON/main/schema/v1/set.json",
  "id": "42c0f3ca-048e-450c-9ab4-c7eda3a97e24",
  "name": {
    "en": "V Jump January 2023",
    "ja": "\uff36\u30b8\u30e3\u30f3\u30d7 \uff12\uff10\uff12\uff13\u5e74 \uff11\u6708\u53f7 \u4ed8\u9332\u30ab\u30fc\u30c9"
  },
  "locales": {
    "jp": {
      "language": "ja",
      "prefix": "VJMP-JP",
      "date": "2022-11-21",
      "image": "https://ms.yugipedia.com//f/f1/VJMP-2023-1-Cover.png",
      "cardImages": {
        "unlimited": {
          "b04de04a-26a3-4dbe-9848-c0dc86d59bdd": "https://ms.yugipedia.com//4/46/BaromettheSacredSheepShrub-VJMP-JP-UR.png"
        }
      },
      "cardInfo": {
        "unlimited": {
          "b04de04a-26a3-4dbe-9848-c0dc86d59bdd": {
            "image": "https://ms.yugipedia.com//4/46/BaromettheSacredSheepShrub-VJMP-JP-UR.png"
          }
        }
      },
      "formats": [
        "ocg"
      ],
      "editions": [
        "unlimited"
      ],
      "externalIDs": {
        "dbIDs": [
          1000008722000
        ]
      }
    }
  },
  "contents": [
    {
      "locales": [
        "jp"
      ],
      "formats": [
        "ocg"
      ],
      "editions": [
        "unlimited"
      ],
      "image": "https://ms.yugipedia.com//f/f1/VJMP-2023-1-Cover.png",
      "cards": [
        {
          "id": "b04de04a-26a3-4dbe-9848-c0dc86d59bdd",
          "card": "8db9691e-3811-4245-ae71-ce9114fc1f14",
          "suffix": "227",
          "rarity": "ultra",
          "imageID": "f1615f92-bd3a-471d-a005-3cc003200b27"
        }
      ],
      "externalIDs": {}
    }
  ],
  "externalIDs": {
    "yugipedia": {
      "name": "V Jump January 2023 promotional card",
      "id": 720324
    }
  }
}