{
  "$schema": "https://raw.githubusercontent.com/matt-roz/YGOJSON/main/schema/v1/set.json",
  "id": "03f6d6c5-2af2-4efe-9790-9b35582c68b6",
  "name": {
    "en": "V Jump October 2024",
    "ja": "\uff36\u30b8\u30e3\u30f3\u30d7 \uff12\uff10\uff12\uff14\u5e74 \uff11\uff10\u6708\u53f7 \u4ed8\u9332\u30ab\u30fc\u30c9"
  },
  "locales": {
    "jp": {
      "language": "ja",
      "prefix": "VJMP-JP",
      "date": "2024-08-21",
      "image": "https://ms.yugipedia.com//1/13/VJMP-2024-10-Cover.png",
      "cardImages": {
        "unlimited": {
          "2ac3453b-c8a5-4aae-8b06-32003973eb74": "https://ms.yugipedia.com//archive/3/3d/20240904083008%21MigratoryZereort-VJMP-JP-UR.png"
        }
      },
      "cardInfo": {
        "unlimited": {
          "2ac3453b-c8a5-4aae-8b06-32003973eb74": {
            "image": "https://ms.yugipedia.com//archive/3/3d/20240904083008%21MigratoryZereort-VJMP-JP-UR.png"
          }
        }
      },
      "formats": [
        "ocg"
      ],
      "editions": [
        "unlimited"
      ],
      "externalIDs": {
        "dbIDs": [
          1000008749000
        ]
      }
    }
  },
  "contents": [
    {
      "locales": [
        "jp"
      ],
      "formats": [
        "ocg"
      ],
      "editions": [
        "unlimited"
      ],
      "image": "https://ms.yugipedia.com//1/13/VJMP-2024-10-Cover.png",
      "cards": [
        {
          "id": "2ac3453b-c8a5-4aae-8b06-32003973eb74",
          "card": "19c13505-9767-4b0b-a6d2-f4f75a650d0a",
          "suffix": "260",
          "rarity": "ultra"
        }
      ],
      "externalIDs": {}
    }
  ],
  "externalIDs": {
    "yugipedia": {
      "name": "V Jump October 2024 promotional card",
      "id": 1071356
    }
  }
}